### ISSUE TITLE
Custom driver always unauthorized (401)

### ISSUE THREAD

**Issue by fmarchal** [arangodb/arangodb#2299]
## my environment running ArangoDB
I'm using the latest ArangoDB of the respective release series:
- [X] 3.1.6

On this operating system:
- [X] Linux 
  - [ ] other: Archlinux

### Server log is:
2017-02-04T16:12:57Z [1807] INFO ArangoDB 3.1.6 [linux] 32bit, using VPack 0.1.30, ICU 54.1, V8 5.0.71.39, OpenSSL 1.0.2j  26 Sep 2016
2017-02-04T16:12:57Z [1807] INFO using SSL options: SSL_OP_CIPHER_SERVER_PREFERENCE, SSL_OP_TLS_ROLLBACK_BUG
2017-02-04T16:12:57Z [1807] INFO file-descriptors (nofiles) hard limit is 4096, soft limit is 1024
2017-02-04T16:12:57Z [1807] INFO Authentication is turned on
2017-02-04T16:12:57Z [1807] INFO Authentication system only
2017-02-04T16:12:57Z [1807] INFO Authentication for unix sockets is turned on
2017-02-04T16:13:00Z [1807] INFO running WAL recovery (1 logfiles)
2017-02-04T16:13:00Z [1807] INFO replaying WAL logfile '/var/lib/arangodb3/journals/logfile-191475.db' (1 of 1)
2017-02-04T16:13:01Z [1807] INFO WAL recovery finished successfully
2017-02-04T16:13:01Z [1807] INFO JavaScript using startup '/usr/share/arangodb3/js', application '/var/lib/arangodb3-apps'
2017-02-04T16:13:07Z [1807] INFO In database '_system': Database is up-to-date (30106/standalone/existing)
2017-02-04T16:13:07Z [1807] INFO In database 'midb': Database is up-to-date (30106/standalone/existing)
2017-02-04T16:13:08Z [1807] INFO using endpoint 'http+tcp://127.0.0.1:8529' for non-encrypted requests
2017-02-04T16:13:09Z [1807] INFO ArangoDB (version 3.1.6 [linux]) is ready for business. Have fun!

### this is an HTTP interface related issue:
After bootstrapping my new driver, I manage to create the following dialog with server, which shouldn't return 401 Unauthorized responses as I understand. This is exported from Wireshark:

---
No.     Time           Source                Destination           Protocol Length Info
      6 1.008212877    127.0.0.1             127.0.0.1             HTTP     258    POST /_open/auth HTTP/1.1  (application/json)

Frame 6: 258 bytes on wire (2064 bits), 258 bytes captured (2064 bits) on interface 0
Ethernet II, Src: 00:00:00_00:00:00 (00:00:00:00:00:00), Dst: 00:00:00_00:00:00 (00:00:00:00:00:00)
Internet Protocol Version 4, Src: 127.0.0.1, Dst: 127.0.0.1
Transmission Control Protocol, Src Port: 38751, Dst Port: 8529, Seq: 1, Ack: 1, Len: 192
Hypertext Transfer Protocol
    POST /_open/auth HTTP/1.1\r\n
    content-length: 37\r\n
    host: localhost:8529\r\n
    Content-Type: application/json; charset=UTF-8\r\n
    Accept: */*\r\n
    Connection: Keep-Alive\r\n
    \r\n
    [Full request URI: http://localhost:8529/_open/auth]
    [HTTP request 1/3]
    [Response in frame: 8]
    [Next request in frame: 10]
    File Data: 37 bytes
JavaScript Object Notation: application/json
    Object
        Member Key: password
            String value: core
            Key: password
        Member Key: username
            String value: core
            Key: username

---
No.     Time           Source                Destination           Protocol Length Info
      8 1.008871620    127.0.0.1             127.0.0.1             HTTP     436    HTTP/1.1 200 OK  (application/json)

Frame 8: 436 bytes on wire (3488 bits), 436 bytes captured (3488 bits) on interface 0
Ethernet II, Src: 00:00:00_00:00:00 (00:00:00:00:00:00), Dst: 00:00:00_00:00:00 (00:00:00:00:00:00)
Internet Protocol Version 4, Src: 127.0.0.1, Dst: 127.0.0.1
Transmission Control Protocol, Src Port: 8529, Dst Port: 38751, Seq: 1, Ack: 193, Len: 370
Hypertext Transfer Protocol
    HTTP/1.1 200 OK\r\n
    Server: ArangoDB\r\n
    Connection: Keep-Alive\r\n
    Content-Type: application/json; charset=utf-8\r\n
    Content-Length: 241\r\n
    \r\n
    [HTTP response 1/3]
    [Time since request: 0.000658743 seconds]
    [Request in frame: 6]
    [Next request in frame: 10]
    [Next response in frame: 11]
    File Data: 241 bytes
JavaScript Object Notation: application/json
    Object
        Member Key: jwt
            String value: eyJhbGciOiJIUzI1NiIsInR5cCI6IkpXVCJ9.eyJleHAiOjE0ODg4MzExNjYsImlhdCI6MS40ODYyMzkxNjYwNDUxMzFlKzYsImlzcyI6ImFyYW5nb2RiIiwicHJlZmVycmVkX3VzZXJuYW1lIjoiY29yZSJ9.h5C_oUpJ0fWfcyoPPabUiH1ke7O7t2mlcrZlXelJPrI=
            Key: jwt
        Member Key: must_change_password
            False value
            Key: must_change_password

---
No.     Time           Source                Destination           Protocol Length Info
     10 1.086403275    127.0.0.1             127.0.0.1             HTTP     387    GET /_api/database/user HTTP/1.1 

Frame 10: 387 bytes on wire (3096 bits), 387 bytes captured (3096 bits) on interface 0
Ethernet II, Src: 00:00:00_00:00:00 (00:00:00:00:00:00), Dst: 00:00:00_00:00:00 (00:00:00:00:00:00)
Internet Protocol Version 4, Src: 127.0.0.1, Dst: 127.0.0.1
Transmission Control Protocol, Src Port: 38751, Dst Port: 8529, Seq: 193, Ack: 371, Len: 321
Hypertext Transfer Protocol
    GET /_api/database/user HTTP/1.1\r\n
    host: localhost:8529\r\n
    Authorization: bearer eyJhbGciOiJIUzI1NiIsInR5cCI6IkpXVCJ9.eyJleHAiOjE0ODg4MzExNjYsImlhdCI6MS40ODYyMzkxNjYwNDUxMzFlKzYsImlzcyI6ImFyYW5nb2RiIiwicHJlZmVycmVkX3VzZXJuYW1lIjoiY29yZSJ9.h5C_oUpJ0fWfcyoPPabUiH1ke7O7t2mlcrZlXelJPrI=\r\n
    Accept: */*\r\n
    Connection: Keep-Alive\r\n
    \r\n
    [Full request URI: http://localhost:8529/_api/database/user]
    [HTTP request 2/3]
    [Prev request in frame: 6]
    [Response in frame: 11]
    [Next request in frame: 13]

---
No.     Time           Source                Destination           Protocol Length Info
     11 1.087139821    127.0.0.1             127.0.0.1             HTTP     258    HTTP/1.1 401 Unauthorized 

Frame 11: 258 bytes on wire (2064 bits), 258 bytes captured (2064 bits) on interface 0
Ethernet II, Src: 00:00:00_00:00:00 (00:00:00:00:00:00), Dst: 00:00:00_00:00:00 (00:00:00:00:00:00)
Internet Protocol Version 4, Src: 127.0.0.1, Dst: 127.0.0.1
Transmission Control Protocol, Src Port: 8529, Dst Port: 38751, Seq: 371, Ack: 514, Len: 192
Hypertext Transfer Protocol
    HTTP/1.1 401 Unauthorized\r\n
    Www-Authenticate: Bearer token_type="JWT", realm="ArangoDB"\r\n
    Server: ArangoDB\r\n
    Connection: Keep-Alive\r\n
    Content-Type: text/plain; charset=utf-8\r\n
    Content-Length: 0\r\n
    \r\n
    [HTTP response 2/3]
    [Time since request: 0.000736546 seconds]
    [Prev request in frame: 6]
    [Prev response in frame: 8]
    [Request in frame: 10]
    [Next request in frame: 13]
    [Next response in frame: 14]

---
No.     Time           Source                Destination           Protocol Length Info
     13 1.089293168    127.0.0.1             127.0.0.1             HTTP     390    GET /_api/database/current HTTP/1.1 

Frame 13: 390 bytes on wire (3120 bits), 390 bytes captured (3120 bits) on interface 0
Ethernet II, Src: 00:00:00_00:00:00 (00:00:00:00:00:00), Dst: 00:00:00_00:00:00 (00:00:00:00:00:00)
Internet Protocol Version 4, Src: 127.0.0.1, Dst: 127.0.0.1
Transmission Control Protocol, Src Port: 38751, Dst Port: 8529, Seq: 514, Ack: 563, Len: 324
Hypertext Transfer Protocol
    GET /_api/database/current HTTP/1.1\r\n
    host: localhost:8529\r\n
    Authorization: bearer eyJhbGciOiJIUzI1NiIsInR5cCI6IkpXVCJ9.eyJleHAiOjE0ODg4MzExNjYsImlhdCI6MS40ODYyMzkxNjYwNDUxMzFlKzYsImlzcyI6ImFyYW5nb2RiIiwicHJlZmVycmVkX3VzZXJuYW1lIjoiY29yZSJ9.h5C_oUpJ0fWfcyoPPabUiH1ke7O7t2mlcrZlXelJPrI=\r\n
    Accept: */*\r\n
    Connection: Keep-Alive\r\n
    \r\n
    [Full request URI: http://localhost:8529/_api/database/current]
    [HTTP request 3/3]
    [Prev request in frame: 10]
    [Response in frame: 14]

---
No.     Time           Source                Destination           Protocol Length Info
     14 1.089666051    127.0.0.1             127.0.0.1             HTTP     258    HTTP/1.1 401 Unauthorized 

Frame 14: 258 bytes on wire (2064 bits), 258 bytes captured (2064 bits) on interface 0
Ethernet II, Src: 00:00:00_00:00:00 (00:00:00:00:00:00), Dst: 00:00:00_00:00:00 (00:00:00:00:00:00)
Internet Protocol Version 4, Src: 127.0.0.1, Dst: 127.0.0.1
Transmission Control Protocol, Src Port: 8529, Dst Port: 38751, Seq: 563, Ack: 838, Len: 192
Hypertext Transfer Protocol
    HTTP/1.1 401 Unauthorized\r\n
    Www-Authenticate: Bearer token_type="JWT", realm="ArangoDB"\r\n
    Server: ArangoDB\r\n
    Connection: Keep-Alive\r\n
    Content-Type: text/plain; charset=utf-8\r\n
    Content-Length: 0\r\n
    \r\n
    [HTTP response 3/3]
    [Time since request: 0.000372883 seconds]
    [Prev request in frame: 10]
    [Prev response in frame: 11]
    [Request in frame: 13]

---

**Comment by jsteemann** [comment]
The first request/response pair shows that the credentials posted to the server are valid, as the server responds with HTTP 200 and returns the JWT token.
The following responses however show that the user has no permission to access the requested URLs.

I guess this is caused by having created the user without permissions to access any databases (or, more precisely, the `_system` database in this case).

For example, the following code for ArangoShell creates a user `foo` with password `bar`, but without any permissions to access a database:
```js
/* create user "foo" with password "bar" */
require("@arangodb/users").save("foo", "bar");
```
To add permissions for a specific database (`_system` in this case), it is required to execute an extra command:
```js
/* grant permissions for "_system" database to user "foo" */ 
require("@arangodb/users").grantDatabase("foo", "_system", "rw");
```
I think executing this extra command should fix the access problems.

The HTTP API equivalents for this are:
```bash
# create user "foo" with password "bar"
curl -X POST http://127.0.0.1:8529/_api/user --basic --user "root:secret" --data '{"user":"foo","passwd":"bar"}'
# grant permissions for "_system" database to user "foo" 
curl -X PUT http://127.0.0.1:8529/_api/user/foo/database/_system --basic --user "root:secret" --data '{"grant":"rw"}'
```
Note that in the above HTTP calls I am using the existing user `root` with password `secret` to execute the requests. Please replace these credentials with the ones of an existing user in your database.

**Comment by fmarchal** [comment]
>I guess this is caused by having created the user without permissions to access any databases (or, more precisely, the _system database in this case).

This is not the problem, which remains. And I've figured out how to access db info via an undocumented way. You'll see:

1. User *root* creates DB *mydb*:
	```sh
	curl -X POST --data-binary @- --dump - http://127.0.0.1:8529/_api/database --basic --user "root:" <<EOF
	{"name":"mydb"}
	EOF
	```
	```http
	HTTP/1.1 201 Created
	Content-Type: application/json; charset=utf-8
	Server: ArangoDB
	Connection: Keep-Alive
	Content-Length: 40

	{"result":true,"error":false,"code":201}
	```
2. User *root* creates user *myuser*:
	```sh
	curl -X POST --data-binary @- --dump - http://127.0.0.1:8529/_api/user --basic --user "root:" <<EOF
	{"user":"myuser", "passwd":"mypass"}
	EOF
	```
	```http
	HTTP/1.1 201 Created
	Content-Type: application/json; charset=utf-8
	Server: ArangoDB
	Connection: Keep-Alive
	Content-Length: 90

	{"user":"myuser","active":true,"extra":{},"changePassword":false,"error":false,"code":201}
	```

3. User *root* grants user *myuser* privileges on db *mydb*:
	```sh
	curl -X PUT --data-binary @- --dump - http://127.0.0.1:8529/_api/user/myuser/database/mydb --basic --user "root:" <<EOF
	{"grant":"rw"}
	EOF
	```
	```http
	HTTP/1.1 200 OK
	Content-Type: application/json; charset=utf-8
	Server: ArangoDB
	Connection: Keep-Alive
	Content-Length: 38

	{"mydb":"rw","error":false,"code":200}
	```

4. User *myuser* requests list of accessible db's, failing, **against documentation**:
	```sh
	curl -X GET --dump - http://127.0.0.1:8529/_api/database/user --basic --user "myuser:mypass" 
	```
	```http
	HTTP/1.1 401 Unauthorized
	Www-Authenticate: Bearer token_type="JWT", realm="ArangoDB"
	Server: ArangoDB
	Connection: Keep-Alive
	Content-Type: text/plain; charset=utf-8
	Content-Length: 0
	```

5. User *myuser* requests list of accessible db's, the **undocumented way**:
	```sh
	curl -X GET --dump - http://127.0.0.1:8529/_db/mydb/_api/database/user --basic --user "myuser:mypass"
	```
	```http
	HTTP/1.1 200 OK
	Content-Type: application/json; charset=utf-8
	Server: ArangoDB
	Connection: Keep-Alive
	Content-Length: 44

	{"result":["mydb"],"error":false,"code":200}
	```

So, operations on getting db's info, must be done 'from' an actual db which the user who demands it, already has access rights to; prepending '/_db/{somedb}' to the documented path.
This implies the asking user must know beforehand one of the db's he has access to. And the user can be wrong, if *root* has revoked privileges.

Thanks.

**Comment by fmarchal** [comment]
Actually the behaviour of ArangoDB regarding database management is completely documented, and I missed the point in my first reading.
But it is in 2 parts: one for the request path suffixes in section "Managing databases using HTTP"; and the other in section "Notes on Databases" where the prefix "/_db/{database-name}/ issue is explained.
I expected section "Managing databases using HTTP" would have paths like "/_db/{database-name}/_api/database/user" in the first place.
So this whole issue is now only about a misleading doc.

**Comment by bgopal-nlg** [comment]
Hi
I am getting the error as below when I am running c:\spline>java -jar admin-0.4.1.jar db-init arangodb://localhost:8529/spline

Caused by: com.arangodb.ArangoDBException: Response: 401, Error: 401 - unauthorized

not sure what is causing an issue.. Pls highlight.
